{
  "schema_version": "0.1.0",
  "provenance": "fixture",
  "generated_from": "fixture0",
  "topics": [
    { "id": "transport-v2", "title": "transport v2 cutover", "phase": "BUILD", "last_commit": "f1c7a9e", "open_questions": 2, "retired": 1 },
    { "id": "billing-sync", "title": "billing sync", "phase": "PLAN", "last_commit": "d4b2e01", "open_questions": 1, "retired": 0 }
  ],
  "items": [
    {
      "id": "TRAN-001",
      "topic": "transport-v2",
      "kind": "decision",
      "label": "single message bus, no fanout",
      "depth": "bedrock",
      "state": "normal",
      "contested": false,
      "is_candidate": false,
      "origin": "@owner [keel]",
      "owner": null,
      "lifecycle_state": "realized",
      "probe": { "status": "green", "pointer": "transport/bus.py:41" },
      "canonical": "specs/.storytime/sessions/transport-v2/_thread.md#TRAN-001",
      "summary": "One bus carries all transport events; consumers filter. Realized at cutover commit; invariant probed on every change.",
      "options": [],
      "edges": { "parent": null, "edge_type": null, "tensions": [], "supersedes": null, "callouts": [] },
      "track": null
    },
    {
      "id": "TRAN-007",
      "topic": "transport-v2",
      "kind": "decision",
      "label": "retry budget lives in transport",
      "depth": "bedrock",
      "state": "violated",
      "contested": false,
      "is_candidate": false,
      "origin": "@operator [ballast]",
      "owner": null,
      "lifecycle_state": "sealed",
      "probe": { "status": "red", "pointer": "transport/retry.py:88" },
      "canonical": "specs/.storytime/sessions/transport-v2/_thread.md#TRAN-007",
      "summary": "Retry policy is transport-owned; callers never loop. Probe cracked: a caller-side retry loop landed in billing-sync 2 commits ago.",
      "options": [],
      "edges": { "parent": "TRAN-001", "edge_type": "refines", "tensions": [], "supersedes": null, "callouts": [ { "target": "billing-sync/BILL-003", "kind": "affects" } ] },
      "track": null
    },
    {
      "id": "TRAN-012",
      "topic": "transport-v2",
      "kind": "decision",
      "label": "cutover order: reads then writes",
      "depth": "forming",
      "state": "waiting_user",
      "contested": false,
      "is_candidate": false,
      "origin": "@user",
      "owner": null,
      "lifecycle_state": "focused",
      "probe": { "status": "none", "pointer": null },
      "canonical": "specs/.storytime/sessions/transport-v2/_thread.md#TRAN-012",
      "summary": "Read path cuts over first behind a flag; writes follow after one clean day. Two options measured, one judgment call open — waiting on @user.",
      "options": [
        { "text": "reads first, writes after 24h clean", "mark": "measured", "pointer": "ops/cutover-trial.md:12" },
        { "text": "big-bang cutover in low-traffic window", "mark": "judgment", "pointer": null }
      ],
      "edges": { "parent": "TRAN-001", "edge_type": "implements", "tensions": [], "supersedes": null, "callouts": [] },
      "track": null
    },
    {
      "id": "TRAN-013",
      "topic": "transport-v2",
      "kind": "decision",
      "label": "dual-write window length",
      "depth": "surface",
      "state": "normal",
      "contested": true,
      "is_candidate": false,
      "origin": "@operator [ballast]",
      "owner": null,
      "lifecycle_state": "proposed",
      "probe": { "status": "none", "pointer": null },
      "canonical": "specs/.storytime/sessions/transport-v2/_thread.md#TRAN-013",
      "summary": "One week vs one day of dual-write. In tension with BILL-009's storage budget; dashed until the tension seals.",
      "options": [],
      "edges": { "parent": "TRAN-012", "edge_type": "refines", "tensions": ["BILL-009"], "supersedes": null, "callouts": [ { "target": "billing-sync/BILL-009", "kind": "related" } ] },
      "track": null
    },
    {
      "id": "TRAN-014",
      "topic": "transport-v2",
      "kind": "delivery",
      "label": "reads cutover flag + shim",
      "depth": "track",
      "state": "blocked",
      "contested": false,
      "is_candidate": false,
      "origin": "@owner [keel]",
      "owner": null,
      "lifecycle_state": "sealed",
      "probe": { "status": "none", "pointer": null },
      "canonical": "specs/.storytime/sessions/transport-v2/_thread.md#TRAN-014",
      "summary": "Delivery leg for TRAN-012's read path. Blocked in review by guardrail GRB-001 (atomic-writes violation).",
      "options": [],
      "edges": { "parent": "TRAN-012", "edge_type": "implements", "tensions": [], "supersedes": null, "callouts": [] },
      "track": { "stage": "review", "acceptance": { "green": 4, "red": 1 } }
    },
    {
      "id": "BILL-003",
      "topic": "billing-sync",
      "kind": "decision",
      "label": "billing consumes bus, no polling",
      "depth": "bedrock",
      "state": "collision",
      "contested": false,
      "is_candidate": false,
      "origin": "@domain [ledger]",
      "owner": null,
      "lifecycle_state": "sealed",
      "probe": { "status": "green", "pointer": "billing/consume.py:17" },
      "canonical": "specs/.storytime/sessions/billing-sync/_thread.md#BILL-003",
      "summary": "Billing reads the transport bus directly. Collision: its caller-side retry loop violates TRAN-007 — both cards go loud until one yields.",
      "options": [],
      "edges": { "parent": null, "edge_type": null, "tensions": [], "supersedes": null, "callouts": [ { "target": "transport-v2/TRAN-007", "kind": "affects" } ] },
      "track": null
    },
    {
      "id": "BILL-009",
      "topic": "billing-sync",
      "kind": "decision",
      "label": "storage budget: 30-day cap",
      "depth": "surface",
      "state": "normal",
      "contested": true,
      "is_candidate": false,
      "origin": "@domain [ledger]",
      "owner": null,
      "lifecycle_state": "proposed",
      "probe": { "status": "none", "pointer": null },
      "canonical": "specs/.storytime/sessions/billing-sync/_thread.md#BILL-009",
      "summary": "Hard 30-day retention cap on sync buffers. In tension with TRAN-013's week-long dual-write window.",
      "options": [],
      "edges": { "parent": null, "edge_type": null, "tensions": ["TRAN-013"], "supersedes": null, "callouts": [ { "target": "transport-v2/TRAN-013", "kind": "related" } ] },
      "track": null
    },
    {
      "id": "TRAN-Q2",
      "topic": "transport-v2",
      "kind": "question",
      "label": "who owns dead-letter drain?",
      "depth": "surface",
      "state": "waiting_user",
      "contested": false,
      "is_candidate": false,
      "origin": "@operator [ballast]",
      "owner": null,
      "lifecycle_state": "proposed",
      "probe": { "status": "none", "pointer": null },
      "canonical": "specs/.storytime/sessions/transport-v2/_thread.md#open-questions",
      "summary": "Dead-letter queue drains need an owner before writes cut over. Waiting on @user to assign.",
      "options": [],
      "edges": { "parent": null, "edge_type": null, "tensions": [], "supersedes": null, "callouts": [] },
      "track": null
    }
  ],
  "directives": [
    { "id": "DIR-001", "text": "never trade clean for easy silently", "origin": "@user", "status": "alive", "fired": 3, "last_candidate": "CAND-004", "source": "local" },
    { "id": "DIR-002", "text": "look for factoring opportunities", "origin": "@user", "status": "alive", "fired": 1, "last_candidate": "CAND-007", "source": "repo" },
    { "id": "DIR-003", "text": "flag schema drift between services", "origin": "@owner [keel]", "status": "parked", "fired": 0, "last_candidate": null, "source": "repo" }
  ],
  "guardrail_blocks": [
    { "id": "GRB-001", "item": "TRAN-014", "guardrail": "check-conventions/atomic-writes", "message": "state write skipped tmp+fsync+mv", "at_commit": "9e2f110" }
  ],
  "candidates": [
    { "id": "CAND-004", "label": "extract retry into transport module", "origin": "directive:DIR-001", "argument": "Billing's caller-side loop duplicates transport retry with a different backoff — the clean option is one owned module; the easy option that shipped is a copy. TRAN-007's probe is red because of it.", "target_topic": "transport-v2" },
    { "id": "CAND-007", "label": "fold bus consumers into registry", "origin": "directive:DIR-002", "argument": "Three consumers self-register three different ways; a registry makes the fourth consumer a one-liner.", "target_topic": "transport-v2" }
  ],
  "budget": { "review_debt": 2, "waiting_user": 2, "open_questions": 3, "unrealized": 3 },
  "lenses": [
    { "id": "arch", "title": "architecture", "kind": "ascii", "content": "  producers ──▶ [ bus ] ──▶ consumers\n     web ─┐              ┌─ billing-sync\n   worker ─┼──▶ topic ───┼─ audit\n     cron ─┘   (single)  └─ notify (candidate)", "source": "transport/README.md:9" },
    { "id": "flow", "title": "changed flow", "kind": "mermaid", "content": "graph LR\n  A[reads] -->|flag on| B[new bus]\n  A -->|flag off| C[old poll]\n  D[writes] -.->|after 24h clean| B", "source": "ops/cutover-plan.md:22" }
  ],
  "teammates": [
    { "codename": "user", "role": "user", "focus": "steering", "status": "active", "last_active": "2026-08-02" },
    { "codename": "keel", "role": "owner", "focus": "architecture", "status": "active", "last_active": "2026-08-02" },
    { "codename": "ballast", "role": "operator", "focus": "reliability", "status": "active", "last_active": "2026-08-01" },
    { "codename": "ledger", "role": "domain", "focus": "billing", "status": "active", "last_active": "2026-07-30" }
  ]
}
